<!DOCTYPE article [
<!ELEMENT article (channels+)>
<!ELEMENT channels (channel)>
<!ELEMENT channel (name,time,count,icon)>

<!ELEMENT name (#PCDATA)>
<!ELEMENT time  (#PCDATA)>
<!ELEMENT count (#PCDATA)>
<!ELEMENT icon (#PCDATA)>
]>
